{
  "$schema": "https://json-schema.org/draft/2020-12/schema",
  "$id": "https://map.dev/schemas/recommendation-result.schema.json",
  "title": "MAP Recommendation Result v1",
  "type": "object",
  "additionalProperties": false,
  "required": ["schemaVersion", "kind", "scan", "recommendations", "limitations"],
  "properties": {
    "schemaVersion": { "const": 1 },
    "kind": { "const": "map.recommendation-result" },
    "scan": {
      "type": "object",
      "additionalProperties": false,
      "required": ["root", "detectedAt"],
      "properties": {
        "root": { "type": "string", "minLength": 1 },
        "detectedAt": { "type": "string", "format": "date-time" }
      }
    },
    "recommendations": { "type": "array", "items": { "$ref": "#/$defs/recommendation" } },
    "limitations": { "type": "array", "minItems": 1, "items": { "type": "string", "minLength": 1 }, "uniqueItems": true }
  },
  "$defs": {
    "recommendation": {
      "type": "object",
      "additionalProperties": false,
      "required": ["pattern", "priority", "rationale", "triggeredBy"],
      "properties": {
        "pattern": { "type": "string", "pattern": "^[a-z0-9]+(?:-[a-z0-9]+)*/[a-z0-9]+(?:-[a-z0-9]+)*$" },
        "priority": { "enum": ["high", "medium", "low"] },
        "rationale": { "type": "string", "minLength": 1 },
        "triggeredBy": { "type": "array", "minItems": 1, "items": { "type": "string", "pattern": "^[a-z][a-z0-9_]*$" }, "uniqueItems": true }
      }
    }
  }
}
